pairID,role,sentence,has_latin,has_foreign_term,ppl,tokens
3353,premise,一系列的钓鱼比赛这个季节增添了一道丰富多彩，明亮美丽的风景，他们在白天垂钓，在夜晚享受生动的社交场景。,False,False,22.041404064258767,53
3353,hypothesis,人们去钓鱼，然后去睡觉。,False,False,45.098236143055395,14
3354,premise,一系列的钓鱼比赛这个季节增添了一道丰富多彩，明亮美丽的风景，他们在白天垂钓，在夜晚享受生动的社交场景。,False,False,22.041404064258767,53
3354,hypothesis,人们喜欢在钓鱼后在酒吧喝很多啤酒。,False,False,36.36844856270536,19
3358,hypothesis,国家历史博物馆有大量的后古典时代的文物。,False,False,18.953031854568042,22
3359,hypothesis,国家历史博物馆里收藏了一些古老农场设备。,False,False,19.914496334790137,22
3360,hypothesis,国家历史博物馆只有近代的东西。,False,False,22.67757958334334,17
3389,hypothesis,市场代表着这座城市的战后重生。,False,False,44.6193112000042,17
3390,hypothesis,这些结构是由世界上最伟大的建筑师建造的。,False,False,11.765795191665397,22
3394,hypothesis,这些商店都提供一些这个城市里最好的食物。,False,False,20.44330839388072,22
3395,hypothesis,附近街道上的商店很有意思。,False,False,31.802803103897354,15
3396,hypothesis,附近的商店比周围任何其他商店都萧条。,False,False,27.77173995364325,20
3397,hypothesis,征收量正在增长，但并不像去年那么快。,False,False,35.442726733501594,20
3398,hypothesis,各个俱乐部都很闷，看起来和所有其他的一样。,False,False,27.662762492522035,23
3399,hypothesis,越来越多的俱乐部具有独到之处，都市风越来越浓郁。,False,False,21.963923031701988,26
3400,premise,绕道来看麦金米德设计的豪宅,False,False,200.6361699057627,15
3401,premise,绕道来看麦金米德设计的豪宅,False,False,200.6361699057627,15
3401,hypothesis,豪宅造价200万美元。,False,False,50.97517691507681,11
3402,premise,绕道来看麦金米德设计的豪宅,False,False,200.6361699057627,15
3430,premise,在周末，您可以加入帕拉帕斯城市公园人群中，那时候，摇滚乐、萨尔萨舞曲和民俗音一起融合成令人着迷的杂音。,False,False,64.4313796879823,53
3431,premise,在周末，您可以加入帕拉帕斯城市公园人群中，那时候，摇滚乐、萨尔萨舞曲和民俗音一起融合成令人着迷的杂音。,False,False,64.4313796879823,53
3432,premise,在周末，您可以加入帕拉帕斯城市公园人群中，那时候，摇滚乐、萨尔萨舞曲和民俗音一起融合成令人着迷的杂音。,False,False,64.4313796879823,53
3433,hypothesis,詹姆斯·威尔逊·马歇尔没有做任何特别的事。,False,False,17.287359780733414,23
3435,hypothesis,詹姆斯·威尔逊·马歇尔发明了一些东西。,False,False,14.467562780274852,21
3442,premise,从此，民族团结一直是民族、宗教和最重要的经济区域利益的次要因素。,False,False,24.491418061417424,34
3442,hypothesis,国家统一根本无关紧要。,False,False,37.83127093407857,13
3443,premise,从此，民族团结一直是民族、宗教和最重要的经济区域利益的次要因素。,False,False,24.491418061417424,34
3443,hypothesis,民族团结比其他任何东西加起来都重要。,False,False,14.48167053884935,20
3444,premise,从此，民族团结一直是民族、宗教和最重要的经济区域利益的次要因素。,False,False,24.491418061417424,34
3444,hypothesis,国家统一从不是第一要务。,False,False,38.33257578764197,14
3455,hypothesis,蒙特塞拉特是山。,False,False,267.00487642488156,10
3457,premise,特制优惠券白天在沙滩上大肆派发，希望能在当晚吸引最多的人群。,False,False,48.802084980506194,32
3457,hypothesis,优惠券晚上在沙滩上发放，希望第二天可以买到。,False,False,28.513619524967766,24
3458,premise,特制优惠券白天在沙滩上大肆派发，希望能在当晚吸引最多的人群。,False,False,48.802084980506194,32
3458,hypothesis,在沙滩上有发放打折券，以期待长期客户。,False,False,71.2594456675051,21
3459,premise,特制优惠券白天在沙滩上大肆派发，希望能在当晚吸引最多的人群。,False,False,48.802084980506194,32
3459,hypothesis,优惠券在沙滩上发放，希望能在晚上吸引顾客。,False,False,25.172001531537052,23
3470,hypothesis,市场出售大量的水果和蔬菜。,False,False,38.86692429782558,15
3520,hypothesis,阿莱奥尔有100栋白房子。,False,False,249.53851349672763,13
3555,hypothesis,参观者喜欢主教席周围的花朵。,False,False,97.9031429750365,16
3568,hypothesis,巴比松附近的城镇人口最多。,False,False,34.12783135642173,15
3570,hypothesis,在巴比松附近的城镇里没有那么多人。,False,False,33.24189975351562,19
3583,premise,香客们会给这些蛇买些蜂蜜蛋糕，然后把这些蛋糕放在寺庙的入口以供蛇享用。,False,False,48.3366600017786,37
3583,hypothesis,蛇最终死于糖尿病有关的并发症。,False,False,54.16431387067895,17
3584,premise,香客们会给这些蛇买些蜂蜜蛋糕，然后把这些蛋糕放在寺庙的入口以供蛇享用。,False,False,48.3366600017786,37
3584,hypothesis,那条蛇住在寺庙入口附近，吃着蜂蜜蛋糕。,False,False,50.410327074823726,21
3585,premise,香客们会给这些蛇买些蜂蜜蛋糕，然后把这些蛋糕放在寺庙的入口以供蛇享用。,False,False,48.3366600017786,37
3585,hypothesis,蛇只会吃尝试进入圣殿的朝圣者。,False,False,104.75359219945841,17
3613,premise,只要你不反对被十年以上经验的常驻专家出席。,False,False,51.99175200109939,23
3613,hypothesis,十岁的孩子是白痴。,False,False,38.69816706792302,11
3614,premise,只要你不反对被十年以上经验的常驻专家出席。,False,False,51.99175200109939,23
3614,hypothesis,十岁的孩子知道所有关于科学的知识。,False,False,19.080799098494623,19
3615,premise,只要你不反对被十年以上经验的常驻专家出席。,False,False,51.99175200109939,23
3615,hypothesis,十岁的孩子知道他们在说什么。,False,False,30.65774062754174,16
3619,hypothesis,天坛公园有点新意。,False,False,56.32907881185835,11
3620,hypothesis,2010年，天坛公园被命名。,False,False,53.08767589619723,13
3621,hypothesis,天坛公园被烧毁。,False,False,66.77315295384705,10
3622,premise,对于电影爱好者来说，最有趣的显示将会是旧镍镉电池，自动检测机和电影机投影出的第一张动态图像合集。,False,False,33.33384343409795,50
3622,hypothesis,对于电影爱好者来说旧式自动点唱机是非常无聊的。,False,False,26.044730260777484,25
3623,premise,对于电影爱好者来说，最有趣的显示将会是旧镍镉电池，自动检测机和电影机投影出的第一张动态图像合集。,False,False,33.33384343409795,50
3623,hypothesis,旧镍钯对电影爱好者来说很有趣。,False,False,45.83962175145246,17
3624,premise,对于电影爱好者来说，最有趣的显示将会是旧镍镉电池，自动检测机和电影机投影出的第一张动态图像合集。,False,False,33.33384343409795,50
3624,hypothesis,古老的镍币影院应由影迷所有。,False,False,200.00258810850548,16
3632,hypothesis,米拉玛是个垃圾场。,False,False,89.88373810791465,11
3637,hypothesis,糟糕的经济给加州造成了很大的伤害。,False,False,18.883021365602833,19
3638,hypothesis,加州的经济一直蓬勃发展。,False,False,25.22129782510735,14
3655,premise,玩世不恭的感觉随着你对小镇温和氛围的第一次体验而消解，它是由复杂的现代性的舒适与后门的荒野的简单欢乐巧妙结合而成的。,False,False,45.16250512743238,60
3655,hypothesis,这个城镇是一个愤怒的、可怕的地方。,False,False,22.4454258567071,19
3656,premise,玩世不恭的感觉随着你对小镇温和氛围的第一次体验而消解，它是由复杂的现代性的舒适与后门的荒野的简单欢乐巧妙结合而成的。,False,False,45.16250512743238,60
3656,hypothesis,这个城镇很友好。,False,False,72.22543786214499,10
3657,premise,玩世不恭的感觉随着你对小镇温和氛围的第一次体验而消解，它是由复杂的现代性的舒适与后门的荒野的简单欢乐巧妙结合而成的。,False,False,45.16250512743238,60
3657,hypothesis,这座小镇如此令人愉快，我从不想离开。,False,False,26.140476971466477,20
3658,premise,"广场中央还有阴凉处和花园, 当地人和游客都喜欢在这会合来吃午餐或晚餐约会。",False,False,34.22965928439516,38
3658,hypothesis,人们喜欢在花园里用餐。,False,False,28.815667139755067,13
3659,premise,"广场中央还有阴凉处和花园, 当地人和游客都喜欢在这会合来吃午餐或晚餐约会。",False,False,34.22965928439516,38
3659,hypothesis,人们排队在花园里吃饭。,False,False,44.16744359634049,13
3660,premise,"广场中央还有阴凉处和花园, 当地人和游客都喜欢在这会合来吃午餐或晚餐约会。",False,False,34.22965928439516,38
3660,hypothesis,这个花园很臭，所以没有人想吃它。,False,False,44.13327533870377,18
3664,premise,晚上，这里有众多优质餐厅、俱乐部、影院可供娱乐，白天，有壮丽的海滩、娱乐码头、古董旋转木马及附近的购物商场。,False,False,24.553924674588497,56
3664,hypothesis,有很多4星级餐厅。,False,False,45.596801439541025,11
3665,premise,晚上，这里有众多优质餐厅、俱乐部、影院可供娱乐，白天，有壮丽的海滩、娱乐码头、古董旋转木马及附近的购物商场。,False,False,24.553924674588497,56
3665,hypothesis,白天和晚上都有很多地方可以去。,False,False,11.200486473011892,17
3666,premise,晚上，这里有众多优质餐厅、俱乐部、影院可供娱乐，白天，有壮丽的海滩、娱乐码头、古董旋转木马及附近的购物商场。,False,False,24.553924674588497,56
3666,hypothesis,那里的晚上没有什么可做的。,False,False,23.83015613827147,15
3670,hypothesis,与镇里的其他地方相比，旗山显得很高,False,False,51.44848847356283,19
3671,hypothesis,旗山在海平面以上。,False,False,80.15044336786612,11
3688,hypothesis,广场无处可坐。,False,False,111.30843804944284,9
3689,hypothesis,堂附近有一个广场。,False,False,124.8038871833427,11
3690,hypothesis,有一个广场有十个长椅。,False,False,90.49169543475496,13
3694,premise,还有很多地点可以用来搞先锋的艺术,False,False,56.18416889877963,18
3694,hypothesis,所有场馆都有对儿童友好的活动。,False,False,36.070726773142226,17
3695,premise,还有很多地点可以用来搞先锋的艺术,False,False,56.18416889877963,18
3695,hypothesis,有些地方有脱衣舞表演。,False,False,28.53902882769747,13
3696,premise,还有很多地点可以用来搞先锋的艺术,False,False,56.18416889877963,18
3696,hypothesis,有些地方有成人表演。,False,False,36.191068114797226,12
3712,hypothesis,最好在您访问前6个月预订。,False,False,44.95704393653739,15
3713,hypothesis,最好早点预定。,False,False,35.81530584140827,9
3714,hypothesis,当你在那里时，你可以预订。,False,False,40.351073846577606,15
3718,premise,"回到镇上, 一次海滨漫步会带你穿过繁华街道上的唐人街。",False,False,61.18185101936532,28
3718,hypothesis,唐人街在圣地亚哥的水面上。,False,False,42.53505420553919,15
3719,premise,"回到镇上, 一次海滨漫步会带你穿过繁华街道上的唐人街。",False,False,61.18185101936532,28
3719,hypothesis,唐人街在水上面。,False,False,98.11672082324812,10
3720,premise,"回到镇上, 一次海滨漫步会带你穿过繁华街道上的唐人街。",False,False,61.18185101936532,28
3720,hypothesis,唐人街离水非常远。,False,False,122.93796027131482,11
3733,premise,后来他控制了法院，以传播正义。,False,False,85.85432610728616,17
3734,premise,后来他控制了法院，以传播正义。,False,False,85.85432610728616,17
3734,hypothesis,那里曾经有处理离婚和家庭纠纷的法庭。,False,False,30.3043095066347,20
3735,premise,后来他控制了法院，以传播正义。,False,False,85.85432610728616,17
3735,hypothesis,那里开庭了。,False,False,152.67751347644003,8
3739,premise,在天星码头的东边，你会来到市政厅。,False,False,43.031077959521795,19
3739,hypothesis,市政厅在终点站东边两个街区。,False,False,56.70732033674834,16
3740,premise,在天星码头的东边，你会来到市政厅。,False,False,43.031077959521795,19
3740,hypothesis,市政厅靠近渡轮码头。,False,False,56.969837071186454,12
3741,premise,在天星码头的东边，你会来到市政厅。,False,False,43.031077959521795,19
3741,hypothesis,市政厅离码头很远。,False,False,81.57681141587844,11
3745,premise,毫无疑问，这座城市最先吸引人的地方在于其众多的历史建筑。,False,False,9.757715354391648,30
3745,hypothesis,这城市也有一间有趣的大学和一个港口。,False,False,45.71953826431024,20
3746,premise,毫无疑问，这座城市最先吸引人的地方在于其众多的历史建筑。,False,False,9.757715354391648,30
3746,hypothesis,这座城市几年前刚刚建成，并没有太多的历史。,False,False,14.724372979238929,23
3747,premise,毫无疑问，这座城市最先吸引人的地方在于其众多的历史建筑。,False,False,9.757715354391648,30
3747,hypothesis,有许多有趣的历史性建筑。,False,False,17.763626646201182,14
3749,hypothesis,这些地区的购物价格略高于其他附近地区。,False,False,25.61191640659373,21
3750,hypothesis,在拉姆布拉的住宅区有购物区。,False,False,109.0919000933219,16
3754,premise,人力资源系统得到巩固，新的公司结构得到迅速确定，以确保继续支持扩大的客户群。,False,False,29.32509046771835,40
3754,hypothesis,通过整合人力资源系统，为新的公司结构创造了空间。,False,False,20.00176505296789,26
3755,premise,人力资源系统得到巩固，新的公司结构得到迅速确定，以确保继续支持扩大的客户群。,False,False,29.32509046771835,40
3755,hypothesis,公司结构已经建立。,False,False,49.60587327773767,11
3756,premise,人力资源系统得到巩固，新的公司结构得到迅速确定，以确保继续支持扩大的客户群。,False,False,29.32509046771835,40
3756,hypothesis,人力资源系统扩大到以前的状态。,False,False,38.60448544866452,17
3757,premise,虽然集资战略可以改进，但可以为这项工作提供资金。,False,False,30.349413277485077,26
3757,hypothesis,有这些任务可用的资源。,False,False,77.34206540417763,13
3758,premise,虽然集资战略可以改进，但可以为这项工作提供资金。,False,False,30.349413277485077,26
3758,hypothesis,这项工作没有可用的资金。,False,False,40.463018420876686,14
3759,premise,虽然集资战略可以改进，但可以为这项工作提供资金。,False,False,30.349413277485077,26
3759,hypothesis,这项工作没有足够的资金。,False,False,26.429676678664585,14
3763,premise,本文提供的农村路线统计数据是基于1989年的国家邮件计数数据,False,False,55.799544647970905,29
3763,hypothesis,本文中的统计数据基于2001年的一份报告。,False,False,18.611194883960216,20
3764,premise,本文提供的农村路线统计数据是基于1989年的国家邮件计数数据,False,False,55.799544647970905,29
3764,hypothesis,本文中的统计数据已过时。,False,False,27.86750299280635,14
3765,premise,本文提供的农村路线统计数据是基于1989年的国家邮件计数数据,False,False,55.799544647970905,29
3765,hypothesis,这页纸包含乡村路线数据。,False,False,142.53010516762322,14
3766,premise,管理人员也可以获得每个要素的临时评级或失败评级。,False,False,36.253895818807905,26
3766,hypothesis,高管考验的每个要素都可能导致不同的评价。,False,False,29.986707895666616,22
3767,premise,管理人员也可以获得每个要素的临时评级或失败评级。,False,False,36.253895818807905,26
3767,hypothesis,执行不能失败。,False,False,94.73848263015142,9
3768,premise,管理人员也可以获得每个要素的临时评级或失败评级。,False,False,36.253895818807905,26
3768,hypothesis,高管必须得到好评才能继续。,False,False,56.48392310645123,15
3790,premise,在入场访谈中讨论的主题是家庭对广告邮件的反应。,False,False,66.69818022228299,25
3790,hypothesis,在入职面试中持反对意见不会帮你得到工作。,False,False,39.65122720910236,22
3791,premise,在入场访谈中讨论的主题是家庭对广告邮件的反应。,False,False,66.69818022228299,25
3791,hypothesis,入场访谈中没有提及广告邮件的任何内容。,False,False,37.317566182144255,21
3792,premise,在入场访谈中讨论的主题是家庭对广告邮件的反应。,False,False,66.69818022228299,25
3792,hypothesis,入门访谈包含了一些关于人们对广告邮件的反应。,False,False,31.47721060404897,24
3796,premise,189和用户成本以相同的方式进行估算。,False,False,55.59114732148316,19
3796,hypothesis,他们预估了用户的成本。,False,False,66.26192419728183,13
3797,premise,189和用户成本以相同的方式进行估算。,False,False,55.59114732148316,19
3797,hypothesis,他们推测用户的费用是10000元。,False,False,72.32107148930301,15
3798,premise,189和用户成本以相同的方式进行估算。,False,False,55.59114732148316,19
3798,hypothesis,他们知道确切的用户成本。,False,False,76.11877436525062,14
3805,hypothesis,从来没有进行过设计研究。,False,False,21.213907535558498,14
3806,hypothesis,有一项设计研究是隔离进行的。,False,False,155.84775845669932,16
3807,hypothesis,设计研究并不成功。,False,False,40.324443623808584,11
3814,premise,所有9个响应的机构报告参与,False,False,188.57229272123203,15
3814,hypothesis,九家机构中只有两家对我们关于参与问题的回应感到困扰。,False,False,37.139576432620835,28
3815,premise,所有9个响应的机构报告参与,False,False,188.57229272123203,15
3815,hypothesis,有9个机构肯定答复他们参与了。,False,False,105.21961406331161,17
3816,premise,所有9个响应的机构报告参与,False,False,188.57229272123203,15
3816,hypothesis,这九个机构很高兴他们有如此高的参与度。,False,False,37.96862781136153,21
3817,premise,自1996年以来，家庭的财富比率迅速上升，1999年达到顶峰6.4。,False,False,21.5952582347028,30
3817,hypothesis,去年，所有家庭的收入都增加了1万美元。,False,False,21.79471312646318,21
3818,premise,自1996年以来，家庭的财富比率迅速上升，1999年达到顶峰6.4。,False,False,21.5952582347028,30
3818,hypothesis,家庭已经失去了很多财富。,False,False,34.038452936155686,14
3819,premise,自1996年以来，家庭的财富比率迅速上升，1999年达到顶峰6.4。,False,False,21.5952582347028,30
3819,hypothesis,家庭财富收入比大增。,False,False,55.48624852679455,12
3823,premise,在子类方法中，为了获得其平均速率，基本类和分工类各自给出了成本上的百分比利润。,False,False,37.42128236216049,41
3823,hypothesis,基本类别不仅仅是成本。,False,False,61.06707247225694,13
3824,premise,在子类方法中，为了获得其平均速率，基本类和分工类各自给出了成本上的百分比利润。,False,False,37.42128236216049,41
3824,hypothesis,价格比成本高10%。,False,False,62.014484165117565,11
3825,premise,在子类方法中，为了获得其平均速率，基本类和分工类各自给出了成本上的百分比利润。,False,False,37.42128236216049,41
3825,hypothesis,价格总是低于成本。,False,False,25.97538757446974,11
3827,hypothesis,首席信息官不清楚成员的责任，也不负责通知他们。,False,False,36.69956289950654,25
3832,hypothesis,只花了两个月来改造它。,False,False,58.73902820119075,13
3833,hypothesis,花了13个月来为潜艇改装锅炉。,False,False,116.43950904206808,16
3834,hypothesis,总共花了13个月来改造锅炉。,False,False,71.36094565325202,15
3850,hypothesis,显然有许多偏见。,False,False,55.29710657736048,10
3851,hypothesis,你很难知道存在多少偏见，因为很难将它们与外部影响区分开。,False,False,27.632882072264636,30
3852,hypothesis,你不知道有多少偏见。,False,False,26.59271388721034,12
3862,premise,由于一方可以以较高的成本完成工作，故技术成本的影响也以与之前相同的方式计算。,False,False,21.267750168670208,40
3862,hypothesis,技术的成本效应是单向的。,False,False,56.056041349314704,14
3863,premise,由于一方可以以较高的成本完成工作，故技术成本的影响也以与之前相同的方式计算。,False,False,21.267750168670208,40
3863,hypothesis,他们还没有想出如何计算技术成本效应。,False,False,50.43102762613759,20
3864,premise,由于一方可以以较高的成本完成工作，故技术成本的影响也以与之前相同的方式计算。,False,False,21.267750168670208,40
3864,hypothesis,他们用历史数据计算技术成本效应。,False,False,53.15162001425328,18
3868,premise,实践4：持续管理风险,False,False,99.90282654254214,12
3868,hypothesis,第四章包含风险管理实践练习。,False,False,38.66622936268995,16
3869,premise,实践4：持续管理风险,False,False,99.90282654254214,12
3869,hypothesis,该书中没有关于长期风险管理的信息。,False,False,16.75913529789823,19
3870,premise,实践4：持续管理风险,False,False,99.90282654254214,12
3870,hypothesis,该练习必须在本周末完成并上交。,False,False,47.91870274917039,17
3877,hypothesis,他们评估其中好处。,False,False,153.47378312300643,11
3878,hypothesis,他们对收益有粗略估计，但可能是错误的。,False,False,34.73312935090282,21
3879,hypothesis,他们不知道如何估算收益。,False,False,33.748900524530214,14
3880,premise,一些设施业主在其施工计划中进行了创新，以缩短停机时间。,False,False,33.855723795993455,29
3880,hypothesis,通过使用创新的施工计划可以减少停机时间。,False,False,26.717291664184117,22
3881,premise,一些设施业主在其施工计划中进行了创新，以缩短停机时间。,False,False,33.855723795993455,29
3881,hypothesis,设备所有者并不关心缩短时间,False,False,75.94196317494055,15
3882,premise,一些设施业主在其施工计划中进行了创新，以缩短停机时间。,False,False,33.855723795993455,29
3882,hypothesis,有效的库存存储是减少故障时间的主要方法之一。,False,False,20.215756712025165,24
3889,premise,此外，计划人员还为新供应商举办各种研讨会并提供教材。,False,False,34.46243960030009,28
3889,hypothesis,计划人员去年削减了所有的研讨会。,False,False,83.31299678668074,18
3890,premise,此外，计划人员还为新供应商举办各种研讨会并提供教材。,False,False,34.46243960030009,28
3891,premise,此外，计划人员还为新供应商举办各种研讨会并提供教材。,False,False,34.46243960030009,28
3891,hypothesis,项目人员举办讲习班。,False,False,98.10469763549615,12
3895,premise,49 工资溢价容许奶油撇油商只需支付现行工资即可获得效率/成本优势。,False,False,155.236464457717,34
3895,hypothesis,喷子做的事情通常是违法的，但他们会逃脱制裁。,False,False,47.67207463109932,24
3896,premise,49 工资溢价容许奶油撇油商只需支付现行工资即可获得效率/成本优势。,False,False,155.236464457717,34
3897,premise,49 工资溢价容许奶油撇油商只需支付现行工资即可获得效率/成本优势。,False,False,155.236464457717,34
3898,premise,例如，员工可能被要求使用机构指定的收费卡作为酒店和其他一些费用。,False,False,40.40186325525787,34
3898,hypothesis,员工没有可用的充值卡。,False,False,38.92055926725552,13
3899,premise,例如，员工可能被要求使用机构指定的收费卡作为酒店和其他一些费用。,False,False,40.40186325525787,34
3899,hypothesis,员工需要用卡去支付他们所有的食物。,False,False,37.96115124346175,19
3900,premise,例如，员工可能被要求使用机构指定的收费卡作为酒店和其他一些费用。,False,False,40.40186325525787,34
3900,hypothesis,雇员需要使用酒店充值卡,False,False,74.88043911342807,13
3907,premise,29因此，21个月应该是需要改造单台电站锅炉总时间合理的，并且在某些情况下保守的估计。,False,False,77.48739664699468,43
3907,hypothesis,它不可能少于21个月。,False,False,87.79902970387894,12
3908,premise,29因此，21个月应该是需要改造单台电站锅炉总时间合理的，并且在某些情况下保守的估计。,False,False,77.48739664699468,43
3908,hypothesis,大约需要21个月的时间才能对一台电站锅炉进行改造。,False,False,23.849754183803235,26
3909,premise,29因此，21个月应该是需要改造单台电站锅炉总时间合理的，并且在某些情况下保守的估计。,False,False,77.48739664699468,43
3909,hypothesis,改装锅炉可以在几天内完成。,False,False,63.83076078026946,15
3916,premise,在初级保健设置中也是如此。,False,False,49.10969937689641,15
3916,hypothesis,这样的事在基层护理中也有发生。,False,False,33.9948606011439,17
3917,premise,在初级保健设置中也是如此。,False,False,49.10969937689641,15
3917,hypothesis,这只发生在专家身上。,False,False,76.31448088258696,12
